{
  "keyId": "pet-production-20260817",
  "algorithm": "ed25519",
  "payload": {
    "schemaVersion": 1,
    "generatedAt": "2026-08-17T08:55:56.254815+00:00",
    "pageSize": 20,
    "items": [
      {
        "id": "deepblue-whale-helper",
        "name": "深蓝鲸小助手",
        "description": "来自深海的温柔鲸鱼，会安静地陪你完成任务。",
        "mediaKind": "static",
        "species": "whale",
        "styles": [
          "cute",
          "calm"
        ],
        "tags": [
          "鲸鱼",
          "深蓝",
          "治愈"
        ],
        "featured": true,
        "contentRating": "everyone",
        "thumbnail": {
          "url": "https://gitee.com/wanggp123/deepseek-harness-pets/raw/master/thumbnails/deepblue-whale-helper.webp",
          "sha256": "6a15ea1eacd97ba2578907c3597d3b16fa5ce2bb6a2c6367dff97708798d04e0",
          "size": 21278,
          "mime": "image/webp"
        },
        "media": {
          "url": "https://gitee.com/wanggp123/deepseek-harness-pets/raw/master/assets/deepblue-whale-helper.png",
          "sha256": "bd6cbbecfed228794bd629afcb0b9c87c5b83623fd96f8b59bd3b9a0e0dfe101",
          "size": 1020847,
          "mime": "image/png"
        },
        "license": {
          "name": "CC0-1.0",
          "url": "https://creativecommons.org/publicdomain/zero/1.0/",
          "author": "DeepSeekHarness Pet Store contributors",
          "sourceUrl": "https://gitee.com/wanggp123/deepseek-harness-pets"
        },
        "behavior": {
          "widthPx": 178,
          "idleMotion": "float",
          "clickMotion": "heart",
          "speechLines": [
            "慢慢来，我陪着你。",
            "深呼吸，再试一次。",
            "今天也很有进展！"
          ]
        }
      },
      {
        "id": "orange-code-kitten",
        "name": "橘子代码猫",
        "description": "活泼的橘猫程序员，喜欢在工作台边缘蹦来蹦去。",
        "mediaKind": "static",
        "species": "cat",
        "styles": [
          "cute",
          "playful"
        ],
        "tags": [
          "橘猫",
          "编程",
          "活泼"
        ],
        "featured": true,
        "contentRating": "everyone",
        "thumbnail": {
          "url": "https://gitee.com/wanggp123/deepseek-harness-pets/raw/master/thumbnails/orange-code-kitten.webp",
          "sha256": "3ea9daf871fb61903de09356830d938db2f9a3e9352e3f3f1ce6e8e407f3eb54",
          "size": 29882,
          "mime": "image/webp"
        },
        "media": {
          "url": "https://gitee.com/wanggp123/deepseek-harness-pets/raw/master/assets/orange-code-kitten.png",
          "sha256": "b181ad6b1af0d00071be40a9da56fdbaf1c74b4a4c5056351c8507eb99e0fbe2",
          "size": 1619114,
          "mime": "image/png"
        },
        "license": {
          "name": "CC0-1.0",
          "url": "https://creativecommons.org/publicdomain/zero/1.0/",
          "author": "DeepSeekHarness Pet Store contributors",
          "sourceUrl": "https://gitee.com/wanggp123/deepseek-harness-pets"
        },
        "behavior": {
          "widthPx": 168,
          "idleMotion": "bounce",
          "clickMotion": "hop",
          "speechLines": [
            "喵！这个问题交给我。",
            "再写一行就休息！",
            "运行成功了吗？"
          ]
        }
      },
      {
        "id": "corgi-space-scout",
        "name": "柯基太空侦察员",
        "description": "穿着深蓝太空服的小柯基，随时准备探索新任务。",
        "mediaKind": "static",
        "species": "dog",
        "styles": [
          "cute",
          "playful"
        ],
        "tags": [
          "柯基",
          "太空",
          "冒险"
        ],
        "featured": true,
        "contentRating": "everyone",
        "thumbnail": {
          "url": "https://gitee.com/wanggp123/deepseek-harness-pets/raw/master/thumbnails/corgi-space-scout.webp",
          "sha256": "73d91c2da240ae37ae6dd19f1678c6f3ff3022454553ab51b00356ca4a47b9ee",
          "size": 25400,
          "mime": "image/webp"
        },
        "media": {
          "url": "https://gitee.com/wanggp123/deepseek-harness-pets/raw/master/assets/corgi-space-scout.png",
          "sha256": "45f2b5dd553f15e1f91773ebc176632223ed113785840bd38b1af96eb4ede522",
          "size": 1331645,
          "mime": "image/png"
        },
        "license": {
          "name": "CC0-1.0",
          "url": "https://creativecommons.org/publicdomain/zero/1.0/",
          "author": "DeepSeekHarness Pet Store contributors",
          "sourceUrl": "https://gitee.com/wanggp123/deepseek-harness-pets"
        },
        "behavior": {
          "widthPx": 176,
          "idleMotion": "bounce",
          "clickMotion": "spin",
          "speechLines": [
            "侦察完毕，一切正常！",
            "出发，探索下一步。",
            "收到你的指令啦！"
          ]
        }
      },
      {
        "id": "arctic-cyber-fox",
        "name": "极光赛博狐",
        "description": "带着青蓝极光纹路的雪狐，安静又机敏。",
        "mediaKind": "static",
        "species": "fantasy",
        "styles": [
          "cute",
          "calm",
          "cyber"
        ],
        "tags": [
          "雪狐",
          "极光",
          "赛博"
        ],
        "featured": true,
        "contentRating": "everyone",
        "thumbnail": {
          "url": "https://gitee.com/wanggp123/deepseek-harness-pets/raw/master/thumbnails/arctic-cyber-fox.webp",
          "sha256": "54a84c0b2b556ef89095e0ac7d0a19459204a18b5e5dab008fb0b79d67f584ae",
          "size": 29564,
          "mime": "image/webp"
        },
        "media": {
          "url": "https://gitee.com/wanggp123/deepseek-harness-pets/raw/master/assets/arctic-cyber-fox.png",
          "sha256": "1dc19813aa2caf61813f69a46521b885e0821e78a69d377932ff9afc75aa48c3",
          "size": 1491633,
          "mime": "image/png"
        },
        "license": {
          "name": "CC0-1.0",
          "url": "https://creativecommons.org/publicdomain/zero/1.0/",
          "author": "DeepSeekHarness Pet Store contributors",
          "sourceUrl": "https://gitee.com/wanggp123/deepseek-harness-pets"
        },
        "behavior": {
          "widthPx": 180,
          "idleMotion": "float",
          "clickMotion": "heart",
          "speechLines": [
            "极光会照亮答案。",
            "我在这里守着工作台。",
            "保持专注，也要休息。"
          ]
        }
      },
      {
        "id": "pocket-helper-robot",
        "name": "口袋助手机器人",
        "description": "圆滚滚的蓝色小机器人，认真记录每一次进展。",
        "mediaKind": "static",
        "species": "robot",
        "styles": [
          "cute",
          "cyber"
        ],
        "tags": [
          "机器人",
          "助手",
          "未来"
        ],
        "featured": false,
        "contentRating": "everyone",
        "thumbnail": {
          "url": "https://gitee.com/wanggp123/deepseek-harness-pets/raw/master/thumbnails/pocket-helper-robot.webp",
          "sha256": "9e896d9336c9af602dbbd8f1bc95c0b79ec0c785f5b9af2ffa347c006115c44d",
          "size": 28662,
          "mime": "image/webp"
        },
        "media": {
          "url": "https://gitee.com/wanggp123/deepseek-harness-pets/raw/master/assets/pocket-helper-robot.png",
          "sha256": "58614500a4457de9b4536bb600f409d39abdd0291b85e1c4af8f64a3fc491e71",
          "size": 1151985,
          "mime": "image/png"
        },
        "license": {
          "name": "CC0-1.0",
          "url": "https://creativecommons.org/publicdomain/zero/1.0/",
          "author": "DeepSeekHarness Pet Store contributors",
          "sourceUrl": "https://gitee.com/wanggp123/deepseek-harness-pets"
        },
        "behavior": {
          "widthPx": 164,
          "idleMotion": "float",
          "clickMotion": "spin",
          "speechLines": [
            "状态良好，继续前进。",
            "已记录这次进展。",
            "需要我陪你检查吗？"
          ]
        }
      },
      {
        "id": "pixel-star-slime",
        "name": "像素星星史莱姆",
        "description": "会发出星光的像素史莱姆，小小一只但元气满满。",
        "mediaKind": "static",
        "species": "pixel",
        "styles": [
          "cute",
          "playful",
          "pixel"
        ],
        "tags": [
          "像素",
          "史莱姆",
          "星星"
        ],
        "featured": false,
        "contentRating": "everyone",
        "thumbnail": {
          "url": "https://gitee.com/wanggp123/deepseek-harness-pets/raw/master/thumbnails/pixel-star-slime.webp",
          "sha256": "c0af7556fcf5e4f8d3dc0e97846309d97c4d0731b9465d680c01890b731cdc41",
          "size": 19650,
          "mime": "image/webp"
        },
        "media": {
          "url": "https://gitee.com/wanggp123/deepseek-harness-pets/raw/master/assets/pixel-star-slime.png",
          "sha256": "a40f925a08b4519ac0826ae017408227551460a3078dcffcea75ef39a26717b1",
          "size": 562332,
          "mime": "image/png"
        },
        "license": {
          "name": "CC0-1.0",
          "url": "https://creativecommons.org/publicdomain/zero/1.0/",
          "author": "DeepSeekHarness Pet Store contributors",
          "sourceUrl": "https://gitee.com/wanggp123/deepseek-harness-pets"
        },
        "behavior": {
          "widthPx": 150,
          "idleMotion": "bounce",
          "clickMotion": "hop",
          "speechLines": [
            "啵！获得一颗小星星。",
            "今天的能量满格！",
            "一起跳到下一步吧！"
          ]
        }
      },
      {
        "id": "sd2-cloud-cat-luna",
        "name": "云朵猫·露娜",
        "description": "Seedance 2.0 原创透明帧动画宠物，可拖动、点击互动并主动陪伴。",
        "mediaKind": "animated",
        "species": "cat",
        "styles": [
          "cute",
          "calm"
        ],
        "tags": [
          "帧动画",
          "透明",
          "可拖动",
          "会说话"
        ],
        "featured": true,
        "contentRating": "everyone",
        "thumbnail": {
          "url": "https://gitee.com/wanggp123/deepseek-harness-pets/raw/master/thumbnails/sd2-cloud-cat-luna.webp",
          "sha256": "98141ec9a9e04810f5fd0c59fb8576f7a64789a0d996a07a5476b67b0f7d8d0d",
          "size": 8952,
          "mime": "image/webp"
        },
        "media": {
          "url": "https://gitee.com/wanggp123/deepseek-harness-pets/raw/master/assets/sd2-cloud-cat-luna.webp",